{
  "admissible": true,
  "admission_reasons": [
    "all checks passed"
  ],
  "arm": "baseline",
  "artifact_consistency": {
    "contradictory_frontmatter": [],
    "duplicate_frontmatter_keys": [],
    "nonexistent_project_paths": [],
    "phantom_file_claims": [],
    "status": "PASS",
    "warnings": []
  },
  "artifacts": {
    "new_artefacts": []
  },
  "auth_preflight_id": "D3_3_3_AUTH_PREFLIGHT",
  "baseline": {
    "direct_child_skill_invoked": true,
    "rdx_bundle_absent": true,
    "rdx_overlay_absent": true,
    "rdx_sidecars_absent": true,
    "wrapper_skill_invoked": false
  },
  "baseline_control": {
    "no_rp_obligation_leakage": true,
    "rdx_bundle_absent": true,
    "rdx_sidecars_absent": true,
    "rp_leakage_hits": [],
    "rule_operation_absent": true
  },
  "cleanup": {
    "observed": {
      "lock_state": "absent",
      "overlay_state": "absent",
      "run_dir_retained": true,
      "transcript_retained": true
    },
    "state": "FINALIZED"
  },
  "hashes": {
    "bundle": "",
    "run_report": "",
    "transcript": "dafa52f3b52576f5f12717785e3f8244b1e8da906c5ee20797bd9edfdc5b0c7b"
  },
  "identity": {
    "base_sha": "60106a882ae44575658384642ad19028ac4757e3",
    "head_sha": "985c3e340f66162a57b2e74b147fb96852a44823"
  },
  "invocation": {
    "command_hash": "d8601032ba1a9f8b6207cb8fb8d3d3375768b74a56b92e3a5eae9df50d19bc6e",
    "exit_code": 0,
    "finished_at": "2026-07-04T06:54:34+00:00",
    "prompt_hash": "a86a88ce6ecde95cee7914f2b47a4db2aa3accdee3e74c8a7dfbd341ced44a73",
    "reason": "normal",
    "started_at": "2026-07-04T06:53:48+00:00"
  },
  "observation": {
    "child_skill_invoked": true,
    "observed_mode": "INFERRED_ABSENT",
    "observed_mode_basis": "no-subagent-events-surrogate",
    "session_id": "a8c5fd43-a827-4dfb-af20-ae75b7b7c90b",
    "task_tool_use_count": 0,
    "transcript_sha256": "dafa52f3b52576f5f12717785e3f8244b1e8da906c5ee20797bd9edfdc5b0c7b",
    "wrapper_skill_invoked": false
  },
  "repetition": 1,
  "run_id": "ruleop-ctrl-011-atdd-api-async-corrected-rep01",
  "run_id_handshake": {
    "invocation_json": "ruleop-ctrl-011-atdd-api-async-corrected-rep01",
    "mismatch": false,
    "run_report": null,
    "schedule": "ruleop-ctrl-011-atdd-api-async-corrected-rep01",
    "workspace_runtime_dir": "ruleop-ctrl-011-atdd-api-async-corrected-rep01"
  },
  "run_outcome": "SUCCESS",
  "runtime": {
    "claude_code_path": "/opt/homebrew/bin/claude",
    "contamination": "",
    "expected_surface": {
      "mcp_servers": [],
      "model": "claude-haiku-4-5-20251001",
      "permission_mode": "bypassPermissions",
      "plugins": [],
      "skills": [
        "bmad-testarch-atdd"
      ],
      "tools": []
    },
    "max_budget_usd": 2.0,
    "model_expected": "claude-haiku-4-5-20251001",
    "model_observed": "claude-haiku-4-5-20251001",
    "observed_surface": {
      "agents": [
        "claude",
        "Explore",
        "general-purpose",
        "Plan",
        "statusline-setup"
      ],
      "analytics_disabled": false,
      "api_key_source": "none",
      "claude_code_version": "2.1.191",
      "fast_mode_state": "off",
      "init_event_seen": true,
      "mcp_servers": [],
      "memory_paths": [],
      "model": "claude-haiku-4-5-20251001",
      "output_style": "default",
      "permission_mode": "bypassPermissions",
      "plugins": [],
      "session_id": "a8c5fd43-a827-4dfb-af20-ae75b7b7c90b",
      "skills": [
        "bmad-testarch-atdd"
      ],
      "slash_commands": [
        "bmad-testarch-atdd",
        "clear",
        "compact",
        "config",
        "context",
        "heapdump",
        "init",
        "reload-skills",
        "review",
        "security-review",
        "usage-credits",
        "extra-usage",
        "usage",
        "insights",
        "goal",
        "team-onboarding"
      ],
      "tools": [
        "Bash",
        "CronCreate",
        "CronDelete",
        "CronList",
        "DesignSync",
        "Edit",
        "EnterWorktree",
        "ExitWorktree",
        "Monitor",
        "NotebookEdit",
        "PushNotification",
        "Read",
        "RemoteTrigger",
        "ScheduleWakeup",
        "SendMessage",
        "Skill",
        "TaskCreate",
        "TaskGet",
        "TaskList",
        "TaskUpdate",
        "ToolSearch",
        "WebFetch",
        "WebSearch",
        "Write"
      ]
    },
    "surface_diff": {
      "missing_expected_skills": [],
      "model_mismatch": false,
      "permission_mode_mismatch": false,
      "unexpected_mcp_servers": [],
      "unexpected_plugins": [],
      "unexpected_skills": [],
      "unexpected_tools": [
        "Bash",
        "CronCreate",
        "CronDelete",
        "CronList",
        "DesignSync",
        "Edit",
        "EnterWorktree",
        "ExitWorktree",
        "Monitor",
        "NotebookEdit",
        "PushNotification",
        "Read",
        "RemoteTrigger",
        "ScheduleWakeup",
        "SendMessage",
        "Skill",
        "TaskCreate",
        "TaskGet",
        "TaskList",
        "TaskUpdate",
        "ToolSearch",
        "WebFetch",
        "WebSearch",
        "Write"
      ]
    },
    "timeout_seconds": 900
  },
  "runtime_result": {
    "authentication_failed": false,
    "is_error": false,
    "model_turn_seen": true,
    "result_event_seen": true,
    "subtype": "success",
    "terminal_reason": "completed"
  },
  "scenario": "atdd-api-async-corrected",
  "schedule_binding": {
    "criteria_version": "rdx-tea-rule-operation-criteria.v1",
    "drift_reasons": [],
    "schedule_sha256": "0b2cd8eede3c8ae6c7d6d02cd98f464a7cfb119012caed41d0b59f3844abc97d",
    "schema_version": "rdx-tea-live-evidence.v4",
    "status": "PASS"
  },
  "schema_version": "rdx-tea-live-evidence.v4",
  "workflow": "atdd",
  "workspace": {
    "config_dir_overridden": false,
    "fixture_hash": "3695de221cc8b4b3bf3d3ce9c443d43a28c4d08b389fcdfef6b5432700e91ba2",
    "path": "/Users/m33tball/bmad_module_builder/rdx-workspace/Rust_bmad_dev/rdx-tea/evals/results/d3_4_rule_operation/workspaces/ruleop-ctrl-011-atdd-api-async-corrected-rep01"
  },
  "workspace_delta": {
    "consistency": "PASS",
    "created_files": [
      "_bmad-run/rdx-tea-invocation.json"
    ],
    "declared_existing_files": [],
    "declared_generated_files": [],
    "declared_missing_files": [],
    "deleted_files": [],
    "modified_files": [],
    "planned_not_generated": false
  }
}