{
  "admissible": true,
  "admission_reasons": [
    "all checks passed"
  ],
  "arm": "candidate",
  "artifact_consistency": {
    "contradictory_frontmatter": [],
    "duplicate_frontmatter_keys": [],
    "nonexistent_project_paths": [],
    "phantom_file_claims": [],
    "status": "PASS",
    "warnings": []
  },
  "artifacts": {
    "new_artefacts": [
      "/Users/m33tball/bmad_module_builder/rdx-workspace/Rust_bmad_dev/rdx-tea/evals/results/d3_4_rule_operation/evidence/docs-only-rust-repo/docs-only-rust-repo/candidate/rep-02/ruleop-cand-008-docs-only-rust-repo-rep02/tea-artifacts/test-design-epic-001.md",
      "/Users/m33tball/bmad_module_builder/rdx-workspace/Rust_bmad_dev/rdx-tea/evals/results/d3_4_rule_operation/evidence/docs-only-rust-repo/docs-only-rust-repo/candidate/rep-02/ruleop-cand-008-docs-only-rust-repo-rep02/tea-artifacts/test-design-progress.md"
    ]
  },
  "auth_preflight_id": "D3_3_3_AUTH_PREFLIGHT",
  "candidate": {
    "active_packs": [],
    "bundle_present": true,
    "child_skill_invoked": true,
    "expected_rp_ids": [],
    "sidecars": [
      "/Users/m33tball/bmad_module_builder/rdx-workspace/Rust_bmad_dev/rdx-tea/evals/results/d3_4_rule_operation/evidence/docs-only-rust-repo/docs-only-rust-repo/candidate/rep-02/ruleop-cand-008-docs-only-rust-repo-rep02/sidecars/test-design-epic-001.md.rdx-tea.json",
      "/Users/m33tball/bmad_module_builder/rdx-workspace/Rust_bmad_dev/rdx-tea/evals/results/d3_4_rule_operation/evidence/docs-only-rust-repo/docs-only-rust-repo/candidate/rep-02/ruleop-cand-008-docs-only-rust-repo-rep02/sidecars/test-design-progress.md.rdx-tea.json"
    ],
    "verifier_all_pass": true,
    "wrapper_skill_invoked": true
  },
  "cleanup": {
    "observed": {
      "lock_state": "absent",
      "overlay_state": "absent",
      "run_dir_retained": true,
      "transcript_retained": true
    },
    "state": "FINALIZED"
  },
  "hashes": {
    "bundle": "a475cd1d12284a4ded628498c0ba2ef8f9e3f311f0e1b174deee47ebdbbeeae0",
    "run_report": "2b0d4bc282bd9b0f2b3c94a1686b09281e06f2073c1c0dbfe023a40d014b1e51",
    "transcript": "d73c0b387afed1d23d56d88827ee6e6781990cd3416ae1a5a722d14c033ddac7"
  },
  "identity": {
    "base_sha": "2120736ed5dbb46475a9fa16228888e82576c0cc",
    "head_sha": "aab69cd7b6c5d85e36add80849da2e563ebcf12f"
  },
  "invocation": {
    "command_hash": "7ff3f032b278fbcb51386e77638610da44787bb11d4317ba63c13a99f03a756a",
    "exit_code": 0,
    "finished_at": "2026-07-04T06:49:31+00:00",
    "prompt_hash": "e82a4747aebe9cfafaff0b64d5b3642ce2253fe911feed05dea0f38a90d4bf53",
    "reason": "normal",
    "started_at": "2026-07-04T06:46:08+00:00"
  },
  "observation": {
    "child_skill_invoked": true,
    "observed_mode": "OBSERVED_SEQUENTIAL",
    "observed_mode_basis": "no-subagent-events-surrogate",
    "session_id": "eb626638-9637-4123-b332-1bf00c95c21b",
    "task_tool_use_count": 0,
    "transcript_sha256": "d73c0b387afed1d23d56d88827ee6e6781990cd3416ae1a5a722d14c033ddac7",
    "wrapper_skill_invoked": true
  },
  "repetition": 2,
  "rule_operation": {
    "active_packs": [],
    "criteria_scenario_key": "docs-only-rust-repo",
    "criteria_version": "rdx-tea-rule-operation-criteria.v1",
    "expected_active_packs": [],
    "expected_rule_condition": "PASS",
    "forbidden_hits": [],
    "forbidden_rule_condition": "PASS",
    "matched_rules": [],
    "packs_ok": true
  },
  "run_id": "ruleop-cand-008-docs-only-rust-repo-rep02",
  "run_id_handshake": {
    "invocation_json": "ruleop-cand-008-docs-only-rust-repo-rep02",
    "mismatch": false,
    "run_report": "ruleop-cand-008-docs-only-rust-repo-rep02",
    "schedule": "ruleop-cand-008-docs-only-rust-repo-rep02",
    "workspace_runtime_dir": "ruleop-cand-008-docs-only-rust-repo-rep02"
  },
  "run_outcome": "SUCCESS",
  "runtime": {
    "claude_code_path": "/opt/homebrew/bin/claude",
    "contamination": "",
    "expected_surface": {
      "mcp_servers": [],
      "model": "claude-haiku-4-5-20251001",
      "permission_mode": "bypassPermissions",
      "plugins": [],
      "skills": [
        "bmad-testarch-test-design",
        "rdx-tea-test-design"
      ],
      "tools": []
    },
    "max_budget_usd": 2.0,
    "model_expected": "claude-haiku-4-5-20251001",
    "model_observed": "claude-haiku-4-5-20251001",
    "observed_surface": {
      "agents": [
        "claude",
        "Explore",
        "general-purpose",
        "Plan",
        "statusline-setup"
      ],
      "analytics_disabled": false,
      "api_key_source": "none",
      "claude_code_version": "2.1.191",
      "fast_mode_state": "off",
      "init_event_seen": true,
      "mcp_servers": [],
      "memory_paths": [],
      "model": "claude-haiku-4-5-20251001",
      "output_style": "default",
      "permission_mode": "bypassPermissions",
      "plugins": [],
      "session_id": "eb626638-9637-4123-b332-1bf00c95c21b",
      "skills": [
        "bmad-testarch-test-design",
        "rdx-tea-test-design"
      ],
      "slash_commands": [
        "bmad-testarch-test-design",
        "rdx-tea-test-design",
        "clear",
        "compact",
        "config",
        "context",
        "heapdump",
        "init",
        "reload-skills",
        "review",
        "security-review",
        "usage-credits",
        "extra-usage",
        "usage",
        "insights",
        "goal",
        "team-onboarding"
      ],
      "tools": [
        "Bash",
        "CronCreate",
        "CronDelete",
        "CronList",
        "DesignSync",
        "Edit",
        "EnterWorktree",
        "ExitWorktree",
        "Monitor",
        "NotebookEdit",
        "PushNotification",
        "Read",
        "RemoteTrigger",
        "ScheduleWakeup",
        "SendMessage",
        "Skill",
        "TaskCreate",
        "TaskGet",
        "TaskList",
        "TaskUpdate",
        "ToolSearch",
        "WebFetch",
        "WebSearch",
        "Write"
      ]
    },
    "surface_diff": {
      "missing_expected_skills": [],
      "model_mismatch": false,
      "permission_mode_mismatch": false,
      "unexpected_mcp_servers": [],
      "unexpected_plugins": [],
      "unexpected_skills": [],
      "unexpected_tools": [
        "Bash",
        "CronCreate",
        "CronDelete",
        "CronList",
        "DesignSync",
        "Edit",
        "EnterWorktree",
        "ExitWorktree",
        "Monitor",
        "NotebookEdit",
        "PushNotification",
        "Read",
        "RemoteTrigger",
        "ScheduleWakeup",
        "SendMessage",
        "Skill",
        "TaskCreate",
        "TaskGet",
        "TaskList",
        "TaskUpdate",
        "ToolSearch",
        "WebFetch",
        "WebSearch",
        "Write"
      ]
    },
    "timeout_seconds": 900
  },
  "runtime_result": {
    "authentication_failed": false,
    "is_error": false,
    "model_turn_seen": true,
    "result_event_seen": true,
    "subtype": "success",
    "terminal_reason": "completed"
  },
  "scenario": "docs-only-rust-repo",
  "schedule_binding": {
    "criteria_version": "rdx-tea-rule-operation-criteria.v1",
    "drift_reasons": [],
    "schedule_sha256": "0b2cd8eede3c8ae6c7d6d02cd98f464a7cfb119012caed41d0b59f3844abc97d",
    "schema_version": "rdx-tea-live-evidence.v4",
    "status": "PASS"
  },
  "schema_version": "rdx-tea-live-evidence.v4",
  "workflow": "test-design",
  "workspace": {
    "config_dir_overridden": false,
    "fixture_hash": "24c8d22ec93315e4cd868d58581c49c01048d2760b0e6442af43802ccce99356",
    "path": "/Users/m33tball/bmad_module_builder/rdx-workspace/Rust_bmad_dev/rdx-tea/evals/results/d3_4_rule_operation/workspaces/ruleop-cand-008-docs-only-rust-repo-rep02"
  },
  "workspace_delta": {
    "consistency": "PASS",
    "created_files": [
      "_bmad-output/test-design-epic-001.md",
      "_bmad-output/test-design-epic-001.md.rdx-tea.json",
      "_bmad-output/test-design-progress.md",
      "_bmad-output/test-design-progress.md.rdx-tea.json",
      "_bmad-run/rdx-tea-invocation.json"
    ],
    "declared_existing_files": [],
    "declared_generated_files": [],
    "declared_missing_files": [],
    "deleted_files": [],
    "modified_files": [],
    "planned_not_generated": false
  }
}