{
  "admissible": true,
  "admission_reasons": [
    "all checks passed"
  ],
  "arm": "baseline",
  "artifact_consistency": {
    "contradictory_frontmatter": [],
    "duplicate_frontmatter_keys": [],
    "nonexistent_project_paths": [],
    "phantom_file_claims": [],
    "status": "PASS",
    "warnings": []
  },
  "artifacts": {
    "new_artefacts": []
  },
  "auth_preflight_id": "D3_3_3_AUTH_PREFLIGHT",
  "baseline": {
    "direct_child_skill_invoked": true,
    "rdx_bundle_absent": true,
    "rdx_overlay_absent": true,
    "rdx_sidecars_absent": true,
    "wrapper_skill_invoked": false
  },
  "baseline_control": {
    "no_rp_obligation_leakage": true,
    "rdx_bundle_absent": true,
    "rdx_sidecars_absent": true,
    "rp_leakage_hits": [],
    "rule_operation_absent": true
  },
  "cleanup": {
    "observed": {
      "lock_state": "absent",
      "overlay_state": "absent",
      "run_dir_retained": true,
      "transcript_retained": true
    },
    "state": "FINALIZED"
  },
  "hashes": {
    "bundle": "",
    "run_report": "",
    "transcript": "2bf7595f7a6914de3a55b70725e37830405d33d10fa103dadc1f07a5a43f3c3b"
  },
  "identity": {
    "base_sha": "2754ddefc2ebb49b69c85fc596f2d6cf28c9140e",
    "head_sha": "7d602776c1ea78fc9117b0fa87cc7494bc071e92"
  },
  "invocation": {
    "command_hash": "5938688c2ecc5330a2d7a74c69b533c01a34af1dc49e828e346e4e2327ff7a56",
    "exit_code": 0,
    "finished_at": "2026-07-04T06:53:47+00:00",
    "prompt_hash": "c2ce4b15f94973bf16fc0ba9adc59364d5cdab972ed737c5ed7ad88f66fc70fe",
    "reason": "normal",
    "started_at": "2026-07-04T06:53:18+00:00"
  },
  "observation": {
    "child_skill_invoked": true,
    "observed_mode": "INFERRED_ABSENT",
    "observed_mode_basis": "no-subagent-events-surrogate",
    "session_id": "49925b28-dbf9-4f6b-b904-9273d4a78015",
    "task_tool_use_count": 0,
    "transcript_sha256": "2bf7595f7a6914de3a55b70725e37830405d33d10fa103dadc1f07a5a43f3c3b",
    "wrapper_skill_invoked": false
  },
  "repetition": 1,
  "run_id": "ruleop-ctrl-010-test-design-async-rep01",
  "run_id_handshake": {
    "invocation_json": "ruleop-ctrl-010-test-design-async-rep01",
    "mismatch": false,
    "run_report": null,
    "schedule": "ruleop-ctrl-010-test-design-async-rep01",
    "workspace_runtime_dir": "ruleop-ctrl-010-test-design-async-rep01"
  },
  "run_outcome": "SUCCESS",
  "runtime": {
    "claude_code_path": "/opt/homebrew/bin/claude",
    "contamination": "",
    "expected_surface": {
      "mcp_servers": [],
      "model": "claude-haiku-4-5-20251001",
      "permission_mode": "bypassPermissions",
      "plugins": [],
      "skills": [
        "bmad-testarch-test-design"
      ],
      "tools": []
    },
    "max_budget_usd": 2.0,
    "model_expected": "claude-haiku-4-5-20251001",
    "model_observed": "claude-haiku-4-5-20251001",
    "observed_surface": {
      "agents": [
        "claude",
        "Explore",
        "general-purpose",
        "Plan",
        "statusline-setup"
      ],
      "analytics_disabled": false,
      "api_key_source": "none",
      "claude_code_version": "2.1.191",
      "fast_mode_state": "off",
      "init_event_seen": true,
      "mcp_servers": [],
      "memory_paths": [],
      "model": "claude-haiku-4-5-20251001",
      "output_style": "default",
      "permission_mode": "bypassPermissions",
      "plugins": [],
      "session_id": "49925b28-dbf9-4f6b-b904-9273d4a78015",
      "skills": [
        "bmad-testarch-test-design"
      ],
      "slash_commands": [
        "bmad-testarch-test-design",
        "clear",
        "compact",
        "config",
        "context",
        "heapdump",
        "init",
        "reload-skills",
        "review",
        "security-review",
        "usage-credits",
        "extra-usage",
        "usage",
        "insights",
        "goal",
        "team-onboarding"
      ],
      "tools": [
        "Bash",
        "CronCreate",
        "CronDelete",
        "CronList",
        "DesignSync",
        "Edit",
        "EnterWorktree",
        "ExitWorktree",
        "Monitor",
        "NotebookEdit",
        "PushNotification",
        "Read",
        "RemoteTrigger",
        "ScheduleWakeup",
        "SendMessage",
        "Skill",
        "TaskCreate",
        "TaskGet",
        "TaskList",
        "TaskUpdate",
        "ToolSearch",
        "WebFetch",
        "WebSearch",
        "Write"
      ]
    },
    "surface_diff": {
      "missing_expected_skills": [],
      "model_mismatch": false,
      "permission_mode_mismatch": false,
      "unexpected_mcp_servers": [],
      "unexpected_plugins": [],
      "unexpected_skills": [],
      "unexpected_tools": [
        "Bash",
        "CronCreate",
        "CronDelete",
        "CronList",
        "DesignSync",
        "Edit",
        "EnterWorktree",
        "ExitWorktree",
        "Monitor",
        "NotebookEdit",
        "PushNotification",
        "Read",
        "RemoteTrigger",
        "ScheduleWakeup",
        "SendMessage",
        "Skill",
        "TaskCreate",
        "TaskGet",
        "TaskList",
        "TaskUpdate",
        "ToolSearch",
        "WebFetch",
        "WebSearch",
        "Write"
      ]
    },
    "timeout_seconds": 900
  },
  "runtime_result": {
    "authentication_failed": false,
    "is_error": false,
    "model_turn_seen": true,
    "result_event_seen": true,
    "subtype": "success",
    "terminal_reason": "completed"
  },
  "scenario": "test-design-async",
  "schedule_binding": {
    "criteria_version": "rdx-tea-rule-operation-criteria.v1",
    "drift_reasons": [],
    "schedule_sha256": "0b2cd8eede3c8ae6c7d6d02cd98f464a7cfb119012caed41d0b59f3844abc97d",
    "schema_version": "rdx-tea-live-evidence.v4",
    "status": "PASS"
  },
  "schema_version": "rdx-tea-live-evidence.v4",
  "workflow": "test-design",
  "workspace": {
    "config_dir_overridden": false,
    "fixture_hash": "a4860c0c58fbd52d39addf3c212805ebe2b6d995c1074a883fa3ff6b3f71516c",
    "path": "/Users/m33tball/bmad_module_builder/rdx-workspace/Rust_bmad_dev/rdx-tea/evals/results/d3_4_rule_operation/workspaces/ruleop-ctrl-010-test-design-async-rep01"
  },
  "workspace_delta": {
    "consistency": "PASS",
    "created_files": [
      "_bmad-run/rdx-tea-invocation.json"
    ],
    "declared_existing_files": [],
    "declared_generated_files": [],
    "declared_missing_files": [],
    "deleted_files": [],
    "modified_files": [],
    "planned_not_generated": false
  }
}